"IMDBID";"Title";"Genre";"Year";"URL";"Audience_Rating";"Critic_Rating";"Budget_In_Millions";"User_Review"
"tt1049405";"The Other End of the Line";"Comedy, Drama, Romance";2009;"https://m.media-amazon.com/images/M/MV5BMTQ3MTMzMjcxOF5BMl5BanBnXkFtZTcwMzI5NTg5MQ@@._V1_SX300.jpg";6.2;4.0;14.0;"A pretty decent romantic comedy"
"tt1049413";"Up";"Animation, Adventure, Comedy, Family";2009;"https://m.media-amazon.com/images/M/MV5BMTk3NDE2NzI4NF5BMl5BanBnXkFtZTgwNzE1MzEyMTE@._V1_SX300.jpg";8.3;8.8;175.0;"Brilliant, another Pixar home run"
"tt1049415";"Garbage Dreams";"Documentary";2009;"https://images-na.ssl-images-amazon.com/images/M/MV5BMTY0Mjg4NTY0N15BMl5BanBnXkFtZTcwNTUxMTQyMg@@._V1_SX300.jpg";7.6;6.7;0.2;"An Inspiring film on the Impact of Globalization on Cairo's Trash Collectors"
"tt1049948";"Casi divas";"Comedy, Musical";2008;"https://images-na.ssl-images-amazon.com/images/M/MV5BMTM4NDY0OTU2M15BMl5BanBnXkFtZTcwOTUyMDk3Mg@@._V1_SX300.jpg";6.2;5.5;0.0;"Calling all sheltered Americans (like me)... See this movie!!"
"tt1051904";"Goosebumps";"Adventure, Comedy, Family, Fantasy, Horror";2015;"https://m.media-amazon.com/images/M/MV5BMjA1OTUzNTQ5Ml5BMl5BanBnXkFtZTgwODQ4NDkxNjE@._V1_SX300.jpg";6.3;6.0;58.0;"The Vidiot Reviews..."
"tt1053424";"Repo Men";"Action, Crime, Sci-Fi, Thriller";2010;"https://m.media-amazon.com/images/M/MV5BMjA4MTUxODM0MV5BMl5BanBnXkFtZTcwMDg3MTgwMw@@._V1_SX300.jpg";6.3;3.2;32.0;"It seems critics are missing the point."
"tt1054588";"Flash of Genius";"Biography, Drama";2008;"https://m.media-amazon.com/images/M/MV5BMTI5MDI0NDAxOV5BMl5BanBnXkFtZTcwNzk4ODk3MQ@@._V1_SX300.jpg";7.0;5.7;20.0;"Well acted and executed, but slightly mundane."
"tt1054606";"The Imaginarium of Doctor Parnassus";"Adventure, Comedy, Fantasy, Mystery";2010;"https://m.media-amazon.com/images/M/MV5BMTY4Njg4NTA3Nl5BMl5BanBnXkFtZTcwNzYxMzg5Mg@@._V1_SX300.jpg";6.8;6.5;30.0;"Rajo loves it, but knows it won't work... how tragic..."
"tt1055292";"Life as We Know It";"Comedy, Drama, Romance";2010;"https://m.media-amazon.com/images/M/MV5BMTc1OTQzNzE0Nl5BMl5BanBnXkFtZTcwNDU4NDk3Mw@@._V1_SX300.jpg";6.6;3.9;38.0;"Was prepared to not like this, but..."
"tt1055369";"Transformers: Revenge of the Fallen";"Action, Adventure, Sci-Fi";2009;"https://m.media-amazon.com/images/M/MV5BNjk4OTczOTk0NF5BMl5BanBnXkFtZTcwNjQ0NzMzMw@@._V1_SX300.jpg";6.0;3.5;200.0;"Good but not completely satisfactory"
"tt1057500";"Invictus";"Biography, Drama, History, Sport";2009;"https://m.media-amazon.com/images/M/MV5BMjAyMzExMDM1N15BMl5BanBnXkFtZTcwNTcyMTQ5Mg@@._V1_SX300.jpg";7.3;7.4;60.0;"One of Clint's Best..."
"tt1058017";"The Invention of Lying";"Comedy, Fantasy, Romance";2009;"https://m.media-amazon.com/images/M/MV5BMTU2OTQzOTc1Nl5BMl5BanBnXkFtZTcwNDM5MDE4Mg@@._V1_SX300.jpg";6.4;5.8;18.5;"God is an upside down fruit man"
"tt1059786";"Eagle Eye";"Action, Mystery, Thriller";2008;"https://m.media-amazon.com/images/M/MV5BMjA5MTMzMDMzNl5BMl5BanBnXkFtZTcwMzUwNDUzMw@@._V1_SX300.jpg";6.6;4.3;80.0;"A summer blockbuster at heart...just sit back and enjoy the incredibly unrealistic ride"
"tt1060277";"Cloverfield";"Action, Horror, Sci-Fi, Thriller";2008;"https://m.media-amazon.com/images/M/MV5BZDNhNDJlNDktZDI4OC00OTE3LWI2M2UtOThkNTFkNjBjYzRmXkEyXkFqcGdeQXVyNTA4NzY1MzY@._V1_SX300.jpg";7.0;6.4;25.0;"Breath of fresh air"
"tt1062965";"Severed Ways: The Norse Discovery of America";"Adventure, Drama";2007;"https://images-na.ssl-images-amazon.com/images/M/MV5BOTQ2NTU2ODE2Nl5BMl5BanBnXkFtZTcwMTQ2NTUzMg@@._V1_SX300.jpg";4.6;5.1;0.0;"Something different"
"tt1063669";"The Wave";"Drama, Thriller";2011;"https://m.media-amazon.com/images/M/MV5BOWQ4YzBjODItM2I4MS00YThlLTlhZTQtOTZkNzhhNDc5YWM4XkEyXkFqcGdeQXVyMTMxMTY0OTQ@._V1_SX300.jpg";7.6;0.0;5.77;"Fascism is Only A Few Missteps Away"
"tt1065073";"Boyhood";"Drama";2014;"https://m.media-amazon.com/images/M/MV5BMTYzNDc2MDc0N15BMl5BanBnXkFtZTgwOTcwMDQ5MTE@._V1_SX300.jpg";7.9;10.0;4.0;"Not bad, but disappointing"
"tt1067106";"A Christmas Carol";"Animation, Drama, Family, Fantasy";2009;"https://m.media-amazon.com/images/M/MV5BMTM1MTI5ODU4MV5BMl5BanBnXkFtZTcwNTYyNTU4Mg@@._V1_SX300.jpg";6.8;5.5;200.0;"Both children and adults will gain more from this experience than most family films."
"tt1067733";"Patrik, Age 1.5";"Comedy, Drama, Romance";2008;"https://m.media-amazon.com/images/M/MV5BMTg1OTc2MTAyMl5BMl5BanBnXkFtZTcwNzQzMDUxMw@@._V1_SX300.jpg";6.9;6.5;0.0;"A Pleasant Surprise"
"tt1068641";"The Burning Plain";"Crime, Drama, Romance";2009;"https://ia.media-imdb.com/images/M/MV5BM2Q3N2ZkMTEtMjA5NC00MzlhLWJmYTctMTU2MjZjYTg3YmJmXkEyXkFqcGdeQXVyMTQxNzMzNDI@._V1_SX300.jpg";6.8;4.5;20.0;"Solid debut for writer Arriaga."
"tt1068646";"The Class";"Drama";2009;"https://m.media-amazon.com/images/M/MV5BOTJkMDZjNWEtYTM5My00MTgzLWFlN2QtMzUzYjNiZmJkN2I3XkEyXkFqcGdeQXVyMjgyNjk3MzE@._V1_SX300.jpg";7.5;9.2;0.0;"mesmerizing"
"tt1068680";"Yes Man";"Comedy, Romance";2008;"https://m.media-amazon.com/images/M/MV5BMzBmZTMzYmItNzhhMC00M2FkLWIxMGEtMjIxMjAwNmQ2ZmM4XkEyXkFqcGdeQXVyNTIzOTk5ODM@._V1_SX300.jpg";6.8;4.6;70.0;"Pure joy. A great film, true to its rom-com genre roots. I was uplifted, and grandly entertained!"
"tt1069238";"Departures";"Drama, Music";2009;"https://m.media-amazon.com/images/M/MV5BMTUzOTcwOTA2NV5BMl5BanBnXkFtZTcwNDczMzczMg@@._V1_SX300.jpg";8.1;6.8;0.0;"Lyrical Film About Finding Passion in an Unlikely Profession"
"tt1070858";"The Secrets of Jonathan Sperry";"Drama";2009;"https://m.media-amazon.com/images/M/MV5BMTc3NjMzNDA1OV5BMl5BanBnXkFtZTcwNjQ4Nzc4Mg@@._V1_SX300.jpg";7.0;0.0;0.9;"Life as it should be"
"tt1071358";"Another Cinderella Story";"Comedy, Family, Music, Romance";2008;"https://m.media-amazon.com/images/M/MV5BMTUwNDAzMzIxOF5BMl5BanBnXkFtZTgwNTU1NzAwNzE@._V1_SX300.jpg";5.9;0.0;5.0;"Good overall."
"tt1071804";"Ink";"Action, Drama, Fantasy, Sci-Fi";2009;"https://m.media-amazon.com/images/M/MV5BMjIyNzE4NjUwM15BMl5BanBnXkFtZTcwMzUyODg5Mg@@._V1_SX300.jpg";7.0;0.0;0.0;"Truly Remarkable Indie that defies categorization"
"tt1071812";"Mao's Last Dancer";"Biography, Drama, Music";2010;"https://ia.media-imdb.com/images/M/MV5BMTc4MDYxMzgwOF5BMl5BanBnXkFtZTcwNDc4MTM1Mw@@._V1_SX300.jpg";7.3;5.5;0.0;"A moving tale that captures the beauty and inspiration of a man forced to make extraordinary decisions"
"tt1071875";"Ghost Rider: Spirit of Vengeance";"Action, Fantasy, Thriller";2012;"https://m.media-amazon.com/images/M/MV5BMTkwNDM5MDEzOF5BMl5BanBnXkFtZTcwNDEyNTUxNw@@._V1_SX300.jpg";4.3;3.4;57.0;"Worst movie I've seen in a LONG time"
"tt1072748";"Winchester";"Biography, Fantasy, Horror, Mystery, Thriller";2018;"https://m.media-amazon.com/images/M/MV5BMjI2OWE5OGItMTE4Yi00ZmIzLThjZDctNTU1OTMxMTc3Yjg4XkEyXkFqcGdeQXVyMjM4NTM5NDY@._V1_SX300.jpg";5.4;2.8;3.5;"More fun than scary"
"tt1072755";"Minutemen";"Adventure, Comedy, Family, Sci-Fi";2008;"https://m.media-amazon.com/images/M/MV5BMjA1MDYyOTczMF5BMl5BanBnXkFtZTcwNTc2NDU2MQ@@._V1_SX300.jpg";6.0;0.0;0.0;"Just One Big Do-Over"
"tt1073498";"Meet the Spartans";"Comedy";2008;"https://m.media-amazon.com/images/M/MV5BMjAxMDE3NDQwMF5BMl5BanBnXkFtZTcwMjA0MzU1MQ@@._V1_SX300.jpg";2.7;0.9;30.0;"Jason Friedberg & Aaron Seltzer  are hacks"
"tt1074638";"Skyfall";"Action, Adventure, Thriller";2012;"https://m.media-amazon.com/images/M/MV5BNDVhZmJiYWMtNmIzMC00ZWNiLTkzZDYtNGNlZmViMGM4OGExXkEyXkFqcGdeQXVyNTIzOTk5ODM@._V1_SX300.jpg";7.8;8.1;200.0;"Back on the Bond Bandwagon"
"tt1074929";"Adoration";"Drama, Romance";2009;"https://m.media-amazon.com/images/M/MV5BMTMxNzU1MjExNl5BMl5BanBnXkFtZTcwNTkxNDAyMg@@._V1_SX300.jpg";6.3;6.4;4.7;"Connecting the dots"
"tt1075417";"Race to Witch Mountain";"Action, Adventure, Family, Fantasy, Sci-Fi, Thriller";2009;"https://m.media-amazon.com/images/M/MV5BMzQ5MTM5NTU2NV5BMl5BanBnXkFtZTcwMDAzMjAyMg@@._V1_SX300.jpg";5.7;5.2;65.0;"Disney fantasy full of tension ,  intrigue  and spectacular images"
"tt1075747";"Jonah Hex";"Action, Drama, Fantasy, Thriller, Western";2010;"https://m.media-amazon.com/images/M/MV5BMTQ2NzYxNjQyMF5BMl5BanBnXkFtZTcwOTQ0OTI0Mw@@._V1_SX300.jpg";4.7;3.3;47.0;"typical action movie with surprising extra's"
"tt1077262";"Ajami";"Crime, Drama";2009;"https://ia.media-imdb.com/images/M/MV5BMTMyNjY0MDE3MF5BMl5BanBnXkFtZTcwNDk4NTgxMw@@._V1_SX300.jpg";7.4;8.2;0.0;"Israel's mean streets"
"tt1077368";"Dark Shadows";"Comedy, Fantasy, Horror";2012;"https://m.media-amazon.com/images/M/MV5BMjc0NzAyMzI1MF5BMl5BanBnXkFtZTcwMTE0NDQ1Nw@@._V1_SX300.jpg";6.2;5.5;150.0;"OK if you haven't seen the older versions"
"tt1078188";"Boy A";"Drama";2008;"https://m.media-amazon.com/images/M/MV5BMTUyMjY2NDU2Ml5BMl5BanBnXkFtZTcwMDU2MjM3MQ@@._V1_SX300.jpg";7.6;7.5;0.0;"Living with the Sins of Childhood"
"tt1078588";"My Sister's Keeper";"Drama, Family";2009;"https://m.media-amazon.com/images/M/MV5BMTQ2NDg4MDU3NF5BMl5BanBnXkFtZTcwMjg5Njc1Mg@@._V1_SX300.jpg";7.4;5.1;30.0;"Heartwarming adaptation"
"tt1078912";"Night at the Museum: Battle of the Smithsonian";"Adventure, Comedy, Family, Fantasy";2009;"https://m.media-amazon.com/images/M/MV5BMGZjZDE2NjUtMzVkNy00N2UyLTg5MjYtYzY1ZmM1YWY3ZTZmXkEyXkFqcGdeQXVyNjk1Njg5NTA@._V1_SX300.jpg";6.0;4.2;150.0;"Night at the Museum: Battle of the Underdeveloped Plot and Characters"
"tt1078940";"Couples Retreat";"Comedy";2009;"https://m.media-amazon.com/images/M/MV5BMTQxMjI1Nzc0M15BMl5BanBnXkFtZTcwMTc0Mzg2Mg@@._V1_SX300.jpg";5.5;2.3;60.0;"Hilarious at times, but never really strives to be more than average"
"tt1079980";"Death in Love";"Drama, Romance, War";2009;"https://m.media-amazon.com/images/M/MV5BNzYyMDVmNTUtNzgxNi00ODMxLWJjNzgtYWI5YTdiYTQzYzI5XkEyXkFqcGdeQXVyMzM4MjM0Nzg@._V1_SX300.jpg";5.0;3.9;3.0;"Intense adult drama about repercussions of violence and war"
"tt1080016";"Ice Age: Dawn of the Dinosaurs";"Animation, Action, Adventure, Comedy, Family";2009;"https://m.media-amazon.com/images/M/MV5BMTMzNDkzMTcyOV5BMl5BanBnXkFtZTcwNDIzMjM2MQ@@._V1_SX300.jpg";7.0;5.0;90.0;"'Ice Age' Getting Better & Better"
"tt1082601";"Fighting";"Action, Drama, Sport";2009;"https://m.media-amazon.com/images/M/MV5BMTk5NjM3MjA5Nl5BMl5BanBnXkFtZTcwODI2MTQ0Mg@@._V1_SX300.jpg";5.6;6.1;0.0;"Not a knockout !!!"
"tt1082853";"Management";"Comedy, Drama, Romance";2009;"https://m.media-amazon.com/images/M/MV5BMTI0Njg2MTg4OV5BMl5BanBnXkFtZTcwOTgyNjg0Mg@@._V1_SX300.jpg";5.9;5.0;0.0;"Tries too hard"
"tt1082868";"Quarantine";"Horror, Thriller";2008;"https://m.media-amazon.com/images/M/MV5BMjY0MDgwNTQ4OF5BMl5BanBnXkFtZTcwMzQzNjY3MQ@@._V1_SX300.jpg";6.0;5.3;12.0;"Watch the original before this."
"tt1083452";"Eddie the Eagle";"Biography, Comedy, Drama, Sport";2016;"https://m.media-amazon.com/images/M/MV5BMTUxOTc5MTU1NF5BMl5BanBnXkFtZTgwODYyNTA1NzE@._V1_SX300.jpg";7.4;5.4;23.0;"Feel good and let the tears of happiness flow!"
"tt1086216";"Uncertainty";"Drama, Romance, Thriller";2012;"https://m.media-amazon.com/images/M/MV5BMjAxNzc0NTE2Ml5BMl5BanBnXkFtZTcwMTcwMTE5Mg@@._V1_SX300.jpg";5.8;4.5;0.0;"of some interest but the premise is inadequately developed"
"tt1086772";"Blended";"Comedy, Romance";2014;"https://m.media-amazon.com/images/M/MV5BNzc2ODI5NjAyMl5BMl5BanBnXkFtZTgwMzIyOTE4MDE@._V1_SX300.jpg";6.5;3.1;40.0;"Surprisingly Good"
"tt1087527";"Trucker";"Drama";2008;"https://images-na.ssl-images-amazon.com/images/M/MV5BMTUwNDEwOTIyMF5BMl5BanBnXkFtZTcwMzI2ODc1Mg@@._V1_SX300.jpg";6.7;6.1;2.0;"An interesting film but lacks something"
"tt1087890";"Terribly Happy";"Drama, Mystery";2008;"https://images-na.ssl-images-amazon.com/images/M/MV5BMTg4ODYwNTg3M15BMl5BanBnXkFtZTcwMDIyOTYwMw@@._V1_SX300.jpg";6.9;7.4;0.0;"Terribly Happy: Odd title, good film"
"tt1090680";"Salt of This Sea";"Drama, Romance";2008;"https://images-na.ssl-images-amazon.com/images/M/MV5BMjEwODc3MzMyM15BMl5BanBnXkFtZTcwNDE5MjM3Mw@@._V1_SX300.jpg";7.0;4.3;0.92;"Very artistic, well directed to reflect only a bit of the Palestinian suffering"
"tt1091191";"Lone Survivor";"Action, Biography, Drama, Thriller, War";2014;"https://m.media-amazon.com/images/M/MV5BMjA0NTgwOTk5Ml5BMl5BanBnXkFtZTcwMjE3NDc5OQ@@._V1_SX300.jpg";7.5;6.0;40.0;"Brutal and Realistic"
"tt1091229";"Chandni Chowk to China";"Action, Comedy, Fantasy";2009;"https://m.media-amazon.com/images/M/MV5BMTgzMjc3OTUwNF5BMl5BanBnXkFtZTcwMDkyNjkxMg@@._V1_SX300.jpg";4.0;4.4;0.0;"Highly recommended! not to go watch this movie!"
"tt1091617";"Expelled: No Intelligence Allowed";"Documentary";2008;"https://m.media-amazon.com/images/M/MV5BMTY0ODIzMDAxOV5BMl5BanBnXkFtZTcwMTc0MDk2MQ@@._V1_SX300.jpg";3.7;2.0;3.5;"Silly me for thinking this might actually be good..."
"tt1091722";"Adventureland";"Comedy, Drama, Romance";2009;"https://m.media-amazon.com/images/M/MV5BMTI1NTYyMjA2N15BMl5BanBnXkFtZTcwNjU1OTA0Mg@@._V1_SX300.jpg";6.8;7.6;0.0;"Very touching, realistic dramedy"
"tt1091751";"The Longshots";"Biography, Comedy, Drama, Family, Sport";2008;"https://m.media-amazon.com/images/M/MV5BMjA5NDMwODQ3MF5BMl5BanBnXkFtZTcwNTA1NDc4MQ@@._V1_SX300.jpg";5.2;5.2;23.0;"Ignore the low rating!."
"tt1092633";"The Goods: Live Hard, Sell Hard";"Comedy";2009;"https://m.media-amazon.com/images/M/MV5BMTMwNDI1OTk3MF5BMl5BanBnXkFtZTcwMzY5MDI2Mg@@._V1_SX300.jpg";5.8;3.9;0.0;"The Goods sells big laughs"
"tt1093908";"Confessions of a Shopaholic";"Comedy, Family, Romance";2009;"https://m.media-amazon.com/images/M/MV5BMTQ1MzcyMTkwOF5BMl5BanBnXkFtZTcwMDM3MTc5MQ@@._V1_SX300.jpg";5.9;3.8;0.0;"Should make Melanie Griffith proud."
"tt1094661";"Coco Chanel";"Biography, Drama";2008;"https://m.media-amazon.com/images/M/MV5BNTU4MTQ3NDAwNF5BMl5BanBnXkFtZTcwNDQ2MjY2Mg@@._V1_SX300.jpg";7.0;0.0;0.0;"This is not the whole truth"
"tt1095174";"New in Town";"Comedy, Romance";2009;"https://m.media-amazon.com/images/M/MV5BMzAxNzU4MDE1Nl5BMl5BanBnXkFtZTcwOTQ0NDcwMg@@._V1_SX300.jpg";5.6;2.9;8.0;"J.K. Simmons is the old guru of ""New In Twon"""
"tt1095217";"Bad Lieutenant: Port of Call New Orleans";"Crime, Drama";2009;"https://m.media-amazon.com/images/M/MV5BMTcyMzY0NTMzMF5BMl5BanBnXkFtZTcwMTc1MjY4Mg@@._V1_SX300.jpg";6.6;6.9;20.0;"The Nicolas Cage we loved is BACK!!!!!!!!!!!!!!!!!"
"tt1097013";"Next Day Air";"Action, Comedy, Crime";2009;"https://m.media-amazon.com/images/M/MV5BNmFjMTVjZGItMzc3Yy00ZGFhLWIxYmMtMmI1YTEyMjY1ZDQ1XkEyXkFqcGdeQXVyNTIzOTk5ODM@._V1_SX300.jpg";5.8;4.6;3.0;"Similar to the ""Junkyard Willie Movie: Lost In Transit"""
"tt1098327";"Dragonball: Evolution";"Action, Adventure, Fantasy, Sci-Fi, Thriller";2009;"https://m.media-amazon.com/images/M/MV5BMTYzNDM0ODQxMF5BMl5BanBnXkFtZTcwOTMyMzMzMg@@._V1_SX300.jpg";2.6;4.5;30.0;"Overall F grade or 0/10, Save your money! wait until you can watch it online for free!"
"tt1099212";"Twilight";"Drama, Fantasy, Romance";2008;"https://m.media-amazon.com/images/M/MV5BMTQ2NzUxMTAxN15BMl5BanBnXkFtZTcwMzEyMTIwMg@@._V1_SX300.jpg";5.2;5.6;37.0;"I Just Saw Twilight"
"tt1100048";"35 Shots of Rum";"Drama";2009;"https://m.media-amazon.com/images/M/MV5BOTU5ZWZjODctYWY0My00M2U5LWE2NWUtMjRlMjZjNTAwYWIzXkEyXkFqcGdeQXVyNDkzNTM2ODg@._V1_SX300.jpg";7.1;9.2;0.0;"Complex drama that mirrors Ozu"
"tt1100053";"Tormented";"Comedy, Horror";2009;"https://m.media-amazon.com/images/M/MV5BMTM3NDgwNzE4OF5BMl5BanBnXkFtZTcwNTk0MjA2Mg@@._V1_SX300.jpg";5.2;0.0;0.89;"Darren couldn't escape even when he was at home. They sent him texts and e-mails and they set up a website."
"tt1100089";"Foxcatcher";"Biography, Drama, Sport";2015;"https://m.media-amazon.com/images/M/MV5BMTQ2MjQxNjYxOV5BMl5BanBnXkFtZTgwMzIwODUxMzE@._V1_SX300.jpg";7.0;8.1;24.0;"Fox hunting is a bloody sport and so is wrestling"
"tt1103153";"Killers";"Action, Comedy, Romance, Thriller";2010;"https://m.media-amazon.com/images/M/MV5BMTU0NDIwOTcwOV5BMl5BanBnXkFtZTcwNjU3NTQ0Mw@@._V1_SX300.jpg";5.4;2.1;75.0;"Made with the best intentions..."
"tt1103275";"Two Lovers";"Drama, Romance";2009;"https://m.media-amazon.com/images/M/MV5BMTIzNzIzMzc2Ml5BMl5BanBnXkFtZTcwNDE2MjAyMg@@._V1_SX300.jpg";7.0;7.4;12.0;"Not just another romantic movie with Gwyneth Paltrow"
"tt1103982";"The Girlfriend Experience";"Drama";2009;"https://m.media-amazon.com/images/M/MV5BMjE5OTY5MDIzM15BMl5BanBnXkFtZTcwNTU4NzQ0Mg@@._V1_SX300.jpg";5.5;6.6;1.7;"Interesting slice-of-life but light on CHARACTER!"
"tt1104001";"TRON: Legacy";"Action, Adventure, Fantasy, Sci-Fi";2010;"https://m.media-amazon.com/images/M/MV5BMTk4NTk4MTk1OF5BMl5BanBnXkFtZTcwNTE2MDIwNA@@._V1_SX300.jpg";6.8;4.9;170.0;"This will rock for fans of the original but others maybe scratching their heads"
"tt1104083";"Little Ashes";"Biography, Drama, Romance";2009;"https://m.media-amazon.com/images/M/MV5BMTgxOTM0NjcyOV5BMl5BanBnXkFtZTcwMDE0MDAwMg@@._V1_SX300.jpg";6.6;4.1;2.88;"Boring Except for the last Twenty Minutes"
"tt1104733";"Hamlet 2";"Comedy, Music";2008;"https://m.media-amazon.com/images/M/MV5BNDQyNjA5NzExMF5BMl5BanBnXkFtZTcwODIyMjAyNw@@._V1_SX300.jpg";6.4;5.4;9.0;"This Movie Brightened My Day"
"tt1107860";"The Maiden Heist";"Comedy, Crime";2010;"https://m.media-amazon.com/images/M/MV5BMTc0MTc0MjE0MF5BMl5BanBnXkFtZTcwMDU1NzI4Mg@@._V1_SX300.jpg";6.1;0.0;20.0;"Like Freeman's THE CODE, a mix of the decent and not-so-decent"
"tt1109624";"Paddington";"Adventure, Comedy, Family, Fantasy";2015;"https://m.media-amazon.com/images/M/MV5BMTAxOTMwOTkwNDZeQTJeQWpwZ15BbWU4MDEyMTI1NjMx._V1_SX300.jpg";7.2;7.7;55.0;"A sheer delight of a movie"
"tt1111422";"The Taking of Pelham 123";"Action, Crime, Thriller";2009;"https://m.media-amazon.com/images/M/MV5BMTU3NzA4MDcwNV5BMl5BanBnXkFtZTcwMDAyNzc1Mg@@._V1_SX300.jpg";6.4;5.5;100.0;"Denzel Washington does it again"
"tt1111948";"Soul Men";"Comedy, Drama, Music";2008;"https://m.media-amazon.com/images/M/MV5BMTgxNjM4NDM4OF5BMl5BanBnXkFtZTcwNDk0NTM5MQ@@._V1_SX300.jpg";6.5;4.9;0.0;"A nice film : R.I.P Bernie Mac"
"tt1114677";"Hannah Montana: The Movie";"Comedy, Drama, Family, Music, Romance";2009;"https://m.media-amazon.com/images/M/MV5BMTkxNjUxODY3NF5BMl5BanBnXkFtZTcwMjQyMzMzMg@@._V1_SX300.jpg";4.4;4.7;30.0;"It wasn't that bad, people."
"tt1114680";"That Evening Sun";"Drama";2009;"https://m.media-amazon.com/images/M/MV5BMjIzNDM3OTIyMV5BMl5BanBnXkFtZTcwNzc4NzA5Mg@@._V1_SX300.jpg";7.1;7.5;0.0;"Beautifully measured performance by the great Hal Holbrooke"
"tt1114740";"Paul Blart: Mall Cop";"Action, Comedy, Crime, Family";2009;"https://m.media-amazon.com/images/M/MV5BMTM2NzA1MzE1NF5BMl5BanBnXkFtZTcwOTYyNDIzMg@@._V1_SX300.jpg";5.2;3.9;26.0;"Good, Light-hearted Comedy"
"tt1116184";"Jackass 3D";"Documentary, Action, Comedy";2010;"https://m.media-amazon.com/images/M/MV5BMjI3NTQ1NTE4OV5BMl5BanBnXkFtZTcwMzEzMzA3NA@@._V1_SX300.jpg";7.0;5.6;20.0;"Attention: Viewer Digression Advised"
"tt1118045";"Here and There";"Comedy, Drama";2010;"https://m.media-amazon.com/images/M/MV5BMTc2OTY3NzUzOV5BMl5BanBnXkFtZTcwMTY5NjQ0Mw@@._V1_SX300.jpg";6.4;5.7;0.3;"not for most"
"tt1119646";"The Hangover";"Comedy";2009;"https://m.media-amazon.com/images/M/MV5BNGQwZjg5YmYtY2VkNC00NzliLTljYTctNzI5NmU3MjE2ODQzXkEyXkFqcGdeQXVyNzkwMjQ5NzM@._V1_SX300.jpg";7.7;7.3;35.0;"Very Funny movie especially for male audience"
"tt1120985";"Blue Valentine";"Drama, Romance";2011;"https://m.media-amazon.com/images/M/MV5BMTU4MTQ2MzA1Ml5BMl5BanBnXkFtZTcwODE3NTgwNA@@._V1_SX300.jpg";7.4;8.1;3.5;"A Simple and Heartbreaking Story, with Magnificent Screenplay, Performances and Soundtrack"
"tt1121096";"Seventh Son";"Action, Adventure, Fantasy";2015;"https://m.media-amazon.com/images/M/MV5BMjAxNTg2MDkyN15BMl5BanBnXkFtZTgwNzA3NzY1MjE@._V1_SX300.jpg";5.5;3.0;95.0;"Fun but forgettable"
"tt1121786";"Formosa Betrayed";"Thriller";2010;"https://m.media-amazon.com/images/M/MV5BMTM2MDk1OTYyM15BMl5BanBnXkFtZTcwODQzMDUxMw@@._V1_SX300.jpg";6.3;5.2;0.0;"One of the best political thrillers I've seen in a long time"
"tt1121931";"Crank: High Voltage";"Action, Crime, Thriller";2009;"https://m.media-amazon.com/images/M/MV5BMTQzNTU1ODkxNl5BMl5BanBnXkFtZTcwMDgyODEzMg@@._V1_SX300.jpg";6.2;4.1;20.0;"absolute INSANITY!"
"tt1121977";"Mother and Child";"Drama, Romance";2010;"https://m.media-amazon.com/images/M/MV5BMTg4NTM5MTE0N15BMl5BanBnXkFtZTcwOTM2MTgyMw@@._V1_SX300.jpg";7.2;6.4;4.83;"Pitch Perfect & Sensitively Directed"
"tt1122775";"Rosencrantz and Guildenstern Are Undead";"Comedy";2009;"https://m.media-amazon.com/images/M/MV5BMTY1NjU0ODc3Ml5BMl5BanBnXkFtZTcwNTEyNTU1Mw@@._V1_SX300.jpg";5.1;4.5;0.6;"Below the line IFP delivers impressively"
"tt1122836";"Alien Trespass";"Comedy, Horror, Sci-Fi";2009;"https://m.media-amazon.com/images/M/MV5BMTg4NzA1NDA3M15BMl5BanBnXkFtZTcwMjY0NDcyMg@@._V1_SX300.jpg";5.7;4.8;0.0;"Loving tribute to 1950s scifi, somewhat hampered by its very sincerity"
"tt1124037";"Free State of Jones";"Action, Biography, Drama, History, War";2016;"https://m.media-amazon.com/images/M/MV5BMTA4NTYyMTcwNTFeQTJeQWpwZ15BbWU4MDI0NTg0MDkx._V1_SX300.jpg";6.9;5.3;50.0;"A Monumental Piece Of History That Ripples Through Generations"
"tt1124039";"Echelon Conspiracy";"Action, Crime, Mystery, Thriller";2009;"https://m.media-amazon.com/images/M/MV5BMTg2NzQzNzQ2NF5BMl5BanBnXkFtZTcwOTE5MTMyMg@@._V1_SX300.jpg";5.8;2.6;0.0;"Not worth viewing, my opinion, unless you enjoy looking at an attractive cast, no matter what the lines"
"tt1124377";"City of War: The Story of John Rabe";"Biography, Drama, History";2009;"https://m.media-amazon.com/images/M/MV5BMjA5ODk2NDI3Nl5BMl5BanBnXkFtZTcwMTYxMjI0Mw@@._V1_SX300.jpg";7.2;5.7;20.0;"Glad this was made, but could've been much better, more accurate"
"tt1124388";"Play the Game";"Comedy, Romance";2009;"https://m.media-amazon.com/images/M/MV5BNzQwMjc5NjExMF5BMl5BanBnXkFtZTcwODc4MTY3Mw@@._V1_SX300.jpg";6.5;3.5;1.1;"Great story line, very good actors, but poorly executed and edited"
"tt1125849";"The Wrestler";"Drama, Sport";2009;"https://m.media-amazon.com/images/M/MV5BMTc5MjYyOTg4MF5BMl5BanBnXkFtZTcwNDc2MzQwMg@@._V1_SX300.jpg";7.9;8.1;6.0;"The Return of Mickey Rourke"
"tt1125929";"Love Ranch";"Biography, Comedy, Drama";2011;"https://images-na.ssl-images-amazon.com/images/M/MV5BMTQwNzgyNzA4OV5BMl5BanBnXkFtZTcwNzA0MDk0Mw@@._V1_SX300.jpg";5.7;3.7;25.0;"Excellent movie: fine acting, great story, and massive pathos"
"tt1126590";"Big Eyes";"Biography, Crime, Drama, Romance";2014;"https://m.media-amazon.com/images/M/MV5BMjA2ODM5MDE3N15BMl5BanBnXkFtZTgwOTIxNjc1MzE@._V1_SX300.jpg";7.0;6.2;10.0;"TV movie with Cinematic production values"
"tt1126591";"Burlesque";"Drama, Music, Musical, Romance";2010;"https://m.media-amazon.com/images/M/MV5BMjM1ZmI4NmUtMDJmMC00N2NkLTg1NGYtMDUyZDZlMmExNGNiXkEyXkFqcGdeQXVyMTkzODUwNzk@._V1_SX300.jpg";6.4;4.7;55.0;"Entertaining"
"tt1126596";"Adulthood";"Crime, Drama";2008;"https://m.media-amazon.com/images/M/MV5BMjExNzYzNjEzOV5BMl5BanBnXkFtZTcwNzk4Mzk5Mw@@._V1_SX300.jpg";6.7;0.0;0.0;"Well crafted and engaging film"
"tt1126618";"Morning Glory";"Comedy, Drama, Romance";2010;"https://m.media-amazon.com/images/M/MV5BMTYxNDM1NTQ4N15BMl5BanBnXkFtZTcwOTQ0Njg5Mw@@._V1_SX300.jpg";6.5;5.7;40.0;"Thank you bright morning for your splendor!"
"tt1127180";"Drag Me to Hell";"Horror, Thriller";2009;"https://m.media-amazon.com/images/M/MV5BMTQwNTMyNjc5Ml5BMl5BanBnXkFtZTcwOTI2MTQ0Mg@@._V1_SX300.jpg";6.6;8.3;30.0;"Sinister as only Sam Raimi can be"
"tt1127221";"Not Forgotten";"Horror, Thriller";2009;"https://m.media-amazon.com/images/M/MV5BMTI1MzM3NTE4Nl5BMl5BanBnXkFtZTcwMDY4MzIwMg@@._V1_SX300.jpg";4.8;4.8;0.0;"What a Mess!"
"tt1127715";"Sin Nombre";"Adventure, Crime, Drama, Thriller";2009;"https://m.media-amazon.com/images/M/MV5BMTkxMTQ0NjgwNV5BMl5BanBnXkFtZTcwNzM5MjIzMg@@._V1_SX300.jpg";7.6;7.7;0.0;"Terrific Film! a Must SEE"
"tt1127877";"Cold Souls";"Comedy, Drama";2010;"https://m.media-amazon.com/images/M/MV5BMTMwMjA1ODA4OF5BMl5BanBnXkFtZTcwMjA3NjU2Mg@@._V1_SX300.jpg";6.5;6.9;0.0;"Existential Science-Fiction"
"tt1127884";"Hannah Montana and Miley Cyrus: Best of Both Worlds Concert";"Documentary, Music";2008;"https://images-na.ssl-images-amazon.com/images/M/MV5BMTI4NDIwODE4Ml5BMl5BanBnXkFtZTYwNTI5Nzc4._V1_SX300.jpg";2.3;5.9;7.0;"eh"
"tt1127896";"Taking Woodstock";"Biography, Comedy, Drama, Music";2009;"https://m.media-amazon.com/images/M/MV5BNzE5NDYzM2YtMjlhMS00Yjc5LWFhZWUtNjQ4ODVhZTQ4OTFkXkEyXkFqcGdeQXVyNDk3NzU2MTQ@._V1_SX300.jpg";6.7;5.5;30.0;"a cheerful little romp with... AH! HIPPIES!!"
"tt1128071";"Free Style";"Drama";2008;"https://m.media-amazon.com/images/M/MV5BMTU5MzQwNjI4NF5BMl5BanBnXkFtZTcwNzUxOTg3Mg@@._V1_SX300.jpg";4.4;0.0;0.0;"Good film"
"tt1129423";"Fireproof";"Drama, Romance";2008;"https://m.media-amazon.com/images/M/MV5BMGZhYzFjY2ItNDVmZi00Y2Q1LWFmMDgtMzAwYTU3NTI3ZGU4XkEyXkFqcGdeQXVyMTMxMTY0OTQ@._V1_SX300.jpg";6.6;2.8;0.5;"Ignore the nattering nabobs of negativity"
"tt1129442";"Transporter 3";"Action, Crime, Thriller";2008;"https://m.media-amazon.com/images/M/MV5BMTkxNzg1OTU4M15BMl5BanBnXkFtZTcwMjcyMjI5MQ@@._V1_SX300.jpg";6.1;5.1;30.0;"I liked the Movie"
"tt1129445";"Amelia";"Adventure, Biography, Drama, Romance";2009;"https://m.media-amazon.com/images/M/MV5BMTI5NTI3MjA4M15BMl5BanBnXkFtZTcwMTM3Mzc3Mg@@._V1_SX300.jpg";5.8;3.7;40.0;"Ordinary film of extraordinary woman"
"tt1130080";"The Informant!";"Biography, Comedy, Crime, Drama";2009;"https://m.media-amazon.com/images/M/MV5BMTc4MDIyMTM3NV5BMl5BanBnXkFtZTcwNDQ2Nzg2Mg@@._V1_SX300.jpg";6.5;6.6;22.0;"Offbeat movie featuring an excellent performance by Matt Damon"
"tt1130088";"Is Anybody There?";"Drama";2009;"https://m.media-amazon.com/images/M/MV5BNTQxNTA4MDY0M15BMl5BanBnXkFtZTcwMjk2NzE0Mg@@._V1_SX300.jpg";6.8;5.4;0.0;"Yes--A great actor is there."
"tt1130884";"Shutter Island";"Mystery, Thriller";2010;"https://m.media-amazon.com/images/M/MV5BYzhiNDkyNzktNTZmYS00ZTBkLTk2MDAtM2U0YjU1MzgxZjgzXkEyXkFqcGdeQXVyMTMxODk2OTU@._V1_SX300.jpg";8.1;6.3;80.0;"The movie is perfect psycho drama"
"tt1131729";"Pirate Radio";"Comedy, Drama, Music";2009;"https://m.media-amazon.com/images/M/MV5BMTMzMjYzMTMyM15BMl5BanBnXkFtZTcwOTk5NDA5Mg@@._V1_SX300.jpg";7.4;5.8;50.0;"In a 60s party mood - no more.. but no less, either"
"tt1131734";"Jennifer's Body";"Comedy, Horror";2009;"https://m.media-amazon.com/images/M/MV5BMTMxNzYwMjc1Ml5BMl5BanBnXkFtZTcwNDI3MDE3Mg@@._V1_SX300.jpg";5.2;4.7;16.0;"A worthy film not deserving of all the hate."
