"IMDBID";"Title";"Genre";"Year";"URL";"Audience_Rating";"Critic_Rating";"Budget_In_Millions";"User_Review"
"tt2096673";"Inside Out";"Animation, Adventure, Comedy, Drama, Family, Fantasy";2015;"https://m.media-amazon.com/images/M/MV5BOTgxMDQwMDk0OF5BMl5BanBnXkFtZTgwNjU5OTg2NDE@._V1_SX300.jpg";8.2;9.4;175.0;"Amazing movie- Those who bash it because it is not a kid's movie, please stop"
"tt2097298";"McFarland, USA";"Biography, Drama, Sport";2015;"https://m.media-amazon.com/images/M/MV5BMjMwNjY2Mjk5OV5BMl5BanBnXkFtZTgwODM2NTA0MzE@._V1_SX300.jpg";7.4;6.0;17.0;"Don't run away from this movie."
"tt2097307";"Hit and Run";"Action, Comedy, Romance";2012;"https://m.media-amazon.com/images/M/MV5BMjExNTgzMTAzMV5BMl5BanBnXkFtZTcwMDA0ODkxOA@@._V1_SX300.jpg";6.1;5.0;2.0;"A Comedy of Drivers"
"tt2101341";"Dead Man Down";"Action, Crime, Drama, Thriller";2013;"https://m.media-amazon.com/images/M/MV5BMTM2NTU5NTIzMF5BMl5BanBnXkFtZTcwNjQ3MTM5OA@@._V1_SX300.jpg";6.5;3.9;30.0;"Well-acted but preposterous"
"tt2101347";"When Elephants Were Young";"Documentary, Adventure, Drama, Family";2016;"https://m.media-amazon.com/images/M/MV5BMTUzODU0NzM5OV5BMl5BanBnXkFtZTgwMDYxOTEyNzE@._V1_SX300.jpg";7.1;0.0;0.0;"When Elephants Were Young is an absolutely stunning film that captures the complex relationship between elephants and humans in Thailand.I can not recommend this movie enough."
"tt2101383";"Knight of Cups";"Drama, Romance";2016;"https://m.media-amazon.com/images/M/MV5BMjQyOTcwODIyNF5BMl5BanBnXkFtZTgwMDE4OTI4NzE@._V1_SX300.jpg";5.6;5.3;0.0;"Truly Upsetting"
"tt2101441";"Spring Breakers";"Comedy, Crime, Drama";2013;"https://m.media-amazon.com/images/M/MV5BNDBmYjU3NzAtZGVkNS00N2E3LWEyNTgtMjIwMTczYTE0M2Y4XkEyXkFqcGdeQXVyMTMxODk2OTU@._V1_SX300.jpg";5.3;6.3;5.0;"an honest and unsuspecting message for our generation"
"tt2103254";"Tammy";"Comedy, Romance";2014;"https://m.media-amazon.com/images/M/MV5BMjIyMDg1ODM5OV5BMl5BanBnXkFtZTgwMTM4NzgxMTE@._V1._CR3,3,863,1275_SY132_CR0,0,89,132_AL_.jpg_V1_SX300.jpg";4.9;3.9;20.0;"Maybe she should have stayed home."
"tt2103264";"Emperor";"Drama, History, War";2013;"https://m.media-amazon.com/images/M/MV5BMjI4OTcwMTY3N15BMl5BanBnXkFtZTcwMTI1MzcxOQ@@._V1_SX300.jpg";6.5;4.8;0.0;"The Genesis of a Decision"
"tt2103281";"Dawn of the Planet of the Apes";"Action, Adventure, Drama, Sci-Fi";2014;"https://m.media-amazon.com/images/M/MV5BMTgwODk3NDc1N15BMl5BanBnXkFtZTgwNTc1NjQwMjE@._V1_SX300.jpg";7.6;7.9;170.0;"The philosophy of why we go to war"
"tt2106361";"Into the Storm";"Action, Thriller";2014;"https://m.media-amazon.com/images/M/MV5BMjMwODI2ODc3Nl5BMl5BanBnXkFtZTgwMDQwNjkwMjE@._V1_SX300.jpg";5.8;4.4;50.0;"Go watch Twister instead"
"tt2106537";"Matru ki Bijlee ka Mandola";"Comedy, Drama";2013;"https://m.media-amazon.com/images/M/MV5BMTQyMzkxNjI5M15BMl5BanBnXkFtZTcwNDAzODY4OA@@._V1_SX300.jpg";5.7;4.6;0.0;"Absolute Performances!"
"tt2106670";"The Taste of Money";"Drama, Thriller";2013;"https://m.media-amazon.com/images/M/MV5BNTAzMWRmMzktYjJkNi00YTlmLTg0NWUtODM1NTBiZThkZmRiXkEyXkFqcGdeQXVyMjgyNjk3MzE@._V1_SX300.jpg";5.8;5.4;0.0;"Classy movie about class"
"tt2107850";"The Case Against 8";"Documentary, Biography, News";2014;"https://images-na.ssl-images-amazon.com/images/M/MV5BMTAzMzYwNzM2NDheQTJeQWpwZ15BbWU4MDQzNDAxMDEx._V1_SX300.jpg";7.4;0.0;0.0;"A Powerful Human Story..."
"tt2109184";"Paranormal Activity 4";"Horror";2012;"https://m.media-amazon.com/images/M/MV5BNjAxMzM0MjYwM15BMl5BanBnXkFtZTcwMjMwMjAyOA@@._V1_SX300.jpg";4.6;4.0;5.0;"They've Obviously Visited the Well One Too Many Times"
"tt2109248";"Transformers: Age of Extinction";"Action, Adventure, Sci-Fi";2014;"https://m.media-amazon.com/images/M/MV5BMjE1OTMyODA5M15BMl5BanBnXkFtZTgwMjc2MDk3MTE@._V1_SX300.jpg";5.7;3.2;210.0;"Poor plot. Nice effects"
"tt2111392";"Raze";"Action, Drama, Horror";2014;"https://m.media-amazon.com/images/M/MV5BMTkyMjk2OTk2MF5BMl5BanBnXkFtZTgwNjcwMzg3MDE@._V1_SX300.jpg";5.2;4.1;0.0;"Fast paced, great acting"
"tt2112096";"Absolutely Fabulous: The Movie";"Comedy, Crime";2016;"https://m.media-amazon.com/images/M/MV5BMjI4NDI5MDg2OV5BMl5BanBnXkFtZTgwNzA5ODQ3ODE@._V1_SX300.jpg";5.4;5.9;0.0;"Fabulously entertaining"
"tt2112124";"Chennai Express";"Action, Comedy";2013;"https://m.media-amazon.com/images/M/MV5BMjE2OTEyOTA3OV5BMl5BanBnXkFtZTcwNjI4MDk3OQ@@._V1_SX300.jpg";6.0;4.5;0.0;"Chennai Express is the story of Rahul and Meena, who meet on a train, and how the journey affects their lives."
"tt2112868";"Under African Skies";"Documentary, Biography, History";2012;"https://images-na.ssl-images-amazon.com/images/M/MV5BMjM0MDIwMjE0NF5BMl5BanBnXkFtZTcwNTI4NTQ1Nw@@._V1_SX300.jpg";7.8;8.2;0.0;"The roots of rhythm remain"
"tt2118624";"The Final Girls";"Comedy, Horror";2015;"https://m.media-amazon.com/images/M/MV5BMjI4Nzk2NzAzOV5BMl5BanBnXkFtZTgwNjI1NzY4NjE@._V1_SX300.jpg";6.6;5.9;4.5;"Fun, but where's the blood and boobs?"
"tt2119532";"Hacksaw Ridge";"Biography, Drama, History, War";2016;"https://m.media-amazon.com/images/M/MV5BMjQ1NjM3MTUxNV5BMl5BanBnXkFtZTgwMDc5MTY5OTE@._V1_SX300.jpg";8.1;7.1;40.0;"one of the most violent sensory assaults that can be experienced in a cinema"
"tt2119543";"The House with a Clock in Its Walls";"Comedy, Family, Fantasy, Horror, Mystery, Sci-Fi, Thriller";2018;"https://m.media-amazon.com/images/M/MV5BMTk1MzM1ODEwOV5BMl5BanBnXkFtZTgwMTE0OTA4NTM@._V1_SX300.jpg";6.1;5.7;42.0;"The book vs the movie."
"tt2120120";"Pixels";"Action, Comedy, Sci-Fi";2015;"https://m.media-amazon.com/images/M/MV5BMTYxMzM4NDY5N15BMl5BanBnXkFtZTgwNzg1NTI3MzE@._V1_SX300.jpg";5.6;2.7;88.0;"Impatient Haters!!!"
"tt2120152";"The Invisible War";"Documentary, Crime";2012;"https://m.media-amazon.com/images/M/MV5BMTkyNjUzOTg4MV5BMl5BanBnXkFtZTcwOTIyMzc4Nw@@._V1_SX300.jpg";7.6;7.5;0.0;"and this is America, this is the u.s. military, this is the cover ups!"
"tt2123146";"Angry Video Game Nerd: The Movie";"Adventure, Comedy, Sci-Fi";2014;"https://m.media-amazon.com/images/M/MV5BMjA2NzYzMTg4NF5BMl5BanBnXkFtZTgwNDcyMzIwMjE@._V1_SX300.jpg";5.7;0.0;0.33;"I want to like it, but I can't. I got bored on half the movie."
"tt2124908";"Shut Up and Play the Hits";"Documentary, Music";2012;"https://m.media-amazon.com/images/M/MV5BMTQxNjgwMjIzOF5BMl5BanBnXkFtZTcwMjAyNjUwOA@@._V1_SX300.jpg";7.4;7.2;0.0;"Shut Up and See This Movie!!"
"tt2125435";"Beasts of the Southern Wild";"Adventure, Drama, Fantasy";2012;"https://m.media-amazon.com/images/M/MV5BMTgxNDM5MDM1Ml5BMl5BanBnXkFtZTcwOTYwNzQ3Nw@@._V1_SX300.jpg";7.3;8.6;1.8;"magical, thought-provoking, very, very watchable"
"tt2125490";"Detropia";"Documentary";2012;"https://m.media-amazon.com/images/M/MV5BMTAxNjY3NTk2MjheQTJeQWpwZ15BbWU3MDMzOTI0MTg@._V1_SX300.jpg";6.5;6.8;0.0;"Ruin Porn"
"tt2125608";"Searching for Sugar Man";"Documentary, Biography, Music";2012;"https://m.media-amazon.com/images/M/MV5BMWYyMzgxNDQtMDI2Mi00NmMzLWI5MTAtMmUwNDg3Yjg3N2U3XkEyXkFqcGdeQXVyNzI1NzMxNzM@._V1_SX300.jpg";8.2;7.9;0.0;"One Of the Best Films Of the Year"
"tt2125666";"The Queen of Versailles";"Documentary";2014;"https://m.media-amazon.com/images/M/MV5BMTM0MzY0NDc3NV5BMl5BanBnXkFtZTcwMTAyODY4Nw@@._V1_SX300.jpg";7.1;8.0;1.0;"American nightmare"
"tt2126355";"San Andreas";"Action, Adventure, Drama, Thriller";2015;"https://m.media-amazon.com/images/M/MV5BNjI4MTgyOTAxOV5BMl5BanBnXkFtZTgwMjQwOTA4NTE@._V1_SX300.jpg";6.1;4.3;110.0;"Disastrous"
"tt2126357";"Second Act";"Comedy, Romance";2018;"https://m.media-amazon.com/images/M/MV5BMjQ2MjI5Njk0MF5BMl5BanBnXkFtZTgwNDQ2NzczNTM@._V1_SX300.jpg";6.0;4.7;16.0;"An entertaining movie"
"tt2130321";"West of Memphis";"Documentary, Crime";2012;"https://m.media-amazon.com/images/M/MV5BMjIzNDM3NjkzOV5BMl5BanBnXkFtZTcwNjI5Nzg0OA@@._V1_SX300.jpg";7.9;8.0;0.0;"Infuriating, depressing and horrifying but also ultimately inspiring."
"tt2132285";"The Bling Ring";"Biography, Crime, Drama";2013;"https://m.media-amazon.com/images/M/MV5BMTQzMTgwMzQxN15BMl5BanBnXkFtZTcwOTcwNTY0OQ@@._V1_SX300.jpg";5.6;6.6;8.0;"Leaving with a feeling of emptiness is rather the point ... you've just met the Bling Ring."
"tt2140037";"Jane Got a Gun";"Action, Drama, Western";2016;"https://m.media-amazon.com/images/M/MV5BMTgwNDk0NDkwMl5BMl5BanBnXkFtZTgwNzYyNjA3NzE@._V1_SX300.jpg";5.9;4.9;25.0;"She also got a family ..."
"tt2140373";"Saving Mr. Banks";"Biography, Comedy, Drama, Family, Music";2013;"https://m.media-amazon.com/images/M/MV5BMTc0MTQ3NzE4Nl5BMl5BanBnXkFtZTcwMzA4NDM5OQ@@._V1_SX300.jpg";7.5;6.5;35.0;"Delightful"
"tt2140379";"Self/less";"Action, Mystery, Sci-Fi, Thriller";2015;"https://m.media-amazon.com/images/M/MV5BMTU0MTQzNzAxMl5BMl5BanBnXkFtZTgwNjg4MjcxNjE@._V1_SX300.jpg";6.5;3.4;26.0;"Okay, so we could be biased about Ryan Reynolds in an Sci-fi/Action title, but hear me out..."
"tt2140465";"Tanu Weds Manu Returns";"Comedy, Drama, Romance";2015;"https://m.media-amazon.com/images/M/MV5BMjMwMTExMjA1OV5BMl5BanBnXkFtZTgwNDI5MTcyNjE@._V1_SX300.jpg";7.7;0.0;0.0;"Must watch"
"tt2140479";"The Accountant";"Action, Crime, Drama, Thriller";2016;"https://m.media-amazon.com/images/M/MV5BNjFmN2UwYWEtMmNiNi00YTU5LThiM2YtMmU4YzYzYTA3YWFjXkEyXkFqcGdeQXVyNzQ1ODk3MTQ@._V1_SX300.jpg";7.3;5.1;44.0;"Excellent"
"tt2141751";"God Help the Girl";"Drama, Musical, Romance";2014;"https://m.media-amazon.com/images/M/MV5BMTg0MDYwNjg2NF5BMl5BanBnXkFtZTgwMTE1NzMyMjE@._V1_SX300.jpg";6.4;5.8;1.85;"what I wish I'd been been doing while ill in my early 20s, I think."
"tt2141773";"Hell and Back";"Animation, Adventure, Comedy, Fantasy";2015;"https://m.media-amazon.com/images/M/MV5BMjM4NzUxODgyNV5BMl5BanBnXkFtZTgwMDM5MzA3NjE@._V1_SX300.jpg";5.4;0.0;0.0;"Could have been a better rated R animated movie."
"tt2153963";"Tabu";"Drama, Romance";2012;"https://m.media-amazon.com/images/M/MV5BYjM5ZTAyYTktNGYxZS00MTBkLWIyNTktYTRjYzAxNzc3MDAzXkEyXkFqcGdeQXVyMjQ2MTk1OTE@._V1_SX300.jpg";7.3;7.8;0.0;"It succeeds in overcoming its foibles by its sheer eccentricity and stunning cinematography"
"tt2167202";"Getaway";"Action, Crime, Thriller";2013;"https://m.media-amazon.com/images/M/MV5BMTM5NTkzNzk0NF5BMl5BanBnXkFtZTcwMTQwNjE5OQ@@._V1_SX300.jpg";4.4;2.2;18.0;"The Title is the Only Thing Right About This Film"
"tt2170299";"Bad Words";"Comedy, Drama";2014;"https://m.media-amazon.com/images/M/MV5BMTYwNTg0NzQ1NF5BMl5BanBnXkFtZTgwMDQ5OTMwMTE@._V1_SX300.jpg";6.7;5.7;10.0;"Great film. A different kind of ""feel-good"" movie."
"tt2170439";"Horrible Bosses 2";"Comedy, Crime";2014;"https://m.media-amazon.com/images/M/MV5BNzU4OTEzNzAwN15BMl5BanBnXkFtZTgwMTgwODAwMzE@._V1_SX300.jpg";6.3;4.0;42.0;"An unnecessary but funny sequel"
"tt2170593";"St. Vincent";"Comedy, Drama";2014;"https://m.media-amazon.com/images/M/MV5BMTk5NzI5OTA4MF5BMl5BanBnXkFtZTgwNjc4NTM3MjE@._V1_SX300.jpg";7.3;6.4;13.0;"Saint Bill"
"tt2172934";"3 Days to Kill";"Action, Drama, Thriller";2014;"https://m.media-amazon.com/images/M/MV5BMzM0MjE0Nzg1N15BMl5BanBnXkFtZTgwODA4ODE4MDE@._V1_SX300.jpg";6.2;4.0;28.0;"Taken for a Ride"
"tt2172935";"Metallica Through the Never";"Music";2013;"https://m.media-amazon.com/images/M/MV5BMjQwNjk5MTk4Ml5BMl5BanBnXkFtZTcwNTgwNDA5OQ@@._V1_SX300.jpg";7.2;6.1;0.0;"Amazing sound and 3D concert!!"
"tt2172985";"The Art of the Steal";"Comedy, Crime, Thriller";2014;"https://m.media-amazon.com/images/M/MV5BNjUxNjYyNTUxMF5BMl5BanBnXkFtZTgwNDgyMDcyMTE@._V1_SX300.jpg";6.3;5.3;0.0;"Great Movie."
"tt2176013";"Jab Tak Hai Jaan";"Drama, Family, Romance";2012;"https://m.media-amazon.com/images/M/MV5BMTUyMzM5OTM5NF5BMl5BanBnXkFtZTcwNTIwMjA3OA@@._V1_SX300.jpg";6.8;0.0;7.22;"Romance : Immortal Forever"
"tt2177771";"The Monuments Men";"Comedy, Drama, History, War";2014;"https://m.media-amazon.com/images/M/MV5BMjMxMjk4NTM1M15BMl5BanBnXkFtZTgwNjg0MjQ3MDE@._V1_SX300.jpg";6.1;5.2;70.0;"Monuments Men is light entertainment that doesn't bore, but doesn't bring anything new either"
"tt2178470";"Yeh Jawaani Hai Deewani";"Comedy, Drama, Musical, Romance";2013;"https://m.media-amazon.com/images/M/MV5BODA4MjM2ODk4OF5BMl5BanBnXkFtZTcwNDgzODk1OQ@@._V1_SX300.jpg";7.0;0.0;0.0;"Been there ,seen that  feeling but still it holds!!!!"
"tt2179116";"The Kings of Summer";"Adventure, Comedy, Drama";2013;"https://m.media-amazon.com/images/M/MV5BMTc3ODA1NTI0MV5BMl5BanBnXkFtZTcwOTE4OTUzOQ@@._V1_SX300.jpg";7.2;6.1;0.0;"A must see for young teens & parents. The kid that plays Biaggio really steals the movie and is so much fun to watch. I say A"
"tt2179136";"American Sniper";"Action, Biography, Drama, History, Thriller, War";2015;"https://m.media-amazon.com/images/M/MV5BMTkxNzI3ODI4Nl5BMl5BanBnXkFtZTgwMjkwMjY4MjE@._V1_SX300.jpg";7.3;7.2;58.8;"Bradley Cooper bulked up his shoulders and took on a very difficult role that etches him on the list of ""Great Actors"" as he plays the real life character of Chris Kyle."
"tt2179936";"School Dance";"Comedy, Drama, Music";2014;"https://m.media-amazon.com/images/M/MV5BNzEwMDEwMzUwNV5BMl5BanBnXkFtZTgwMTk0MjU5MTE@._V1_SX300.jpg";4.6;0.0;0.0;"I was very surprised in a good way!"
"tt2180411";"Into the Woods";"Adventure, Comedy, Drama, Fantasy, Musical";2014;"https://m.media-amazon.com/images/M/MV5BMTY4MzQ4OTY3NF5BMl5BanBnXkFtZTgwNjM5MDI3MjE@._V1_SX300.jpg";6.0;6.9;50.0;"A good adaptation of a fantastic musical, the rating does not do it justice."
"tt2182115";"The Old Man";"Action, Adventure, Drama";2014;"https://ia.media-imdb.com/images/M/MV5BOTRmN2M4OTAtMWQ1MC00YTNiLTk0NzEtODBmMjE4NTBjZDhlXkEyXkFqcGdeQXVyMjAwMzU2MDY@._V1_SX300.jpg";7.3;0.0;0.0;"A beautiful modern retelling of the Old Man and the Sea"
"tt2182256";"Premature";"Comedy, Fantasy";2014;"https://m.media-amazon.com/images/M/MV5BMjE2OTQ2NDEzMF5BMl5BanBnXkFtZTgwMjA3MjAwMjE@._V1_SX300.jpg";5.8;3.4;0.0;"You can't compare the greats to a movie about ejaculation"
"tt2183034";"Earth to Echo";"Adventure, Family, Sci-Fi";2014;"https://m.media-amazon.com/images/M/MV5BMjEwMzA5Nzk2Ml5BMl5BanBnXkFtZTgwMDM2NzE4MTE@._V1_SX300.jpg";5.8;5.3;13.0;"Solid Entertainment for young people"
"tt2184287";"Summer in February";"Biography, Drama, Romance";2014;"https://m.media-amazon.com/images/M/MV5BMjMwODI0NDAyNF5BMl5BanBnXkFtZTgwMTI1NDM5MDE@._V1_SX300.jpg";5.7;2.2;6.38;"Good"
"tt2184339";"The Purge";"Horror, Thriller";2013;"https://m.media-amazon.com/images/M/MV5BMTQzNTcwODEyM15BMl5BanBnXkFtZTcwMjM1MDI0OQ@@._V1_SX300.jpg";5.7;4.1;3.0;"Should have been better"
"tt2185037";"Running Man";"Comedy, Game-Show, Reality-TV";2010;"https://m.media-amazon.com/images/M/MV5BYTNhZWRiN2ItNmYxYi00M2Q1LWE4MTUtYTMwZDJlOTljM2I5XkEyXkFqcGdeQXVyNjQ3NzI2MDk@._V1_SX300.jpg";8.8;0.0;0.0;"Was good until they make the guests win"
"tt2191701";"Grown Ups 2";"Comedy";2013;"https://m.media-amazon.com/images/M/MV5BMTgwNTI2MDI0OF5BMl5BanBnXkFtZTcwMTk5MDg0OQ@@._V1_SX300.jpg";5.4;1.9;80.0;"Chaotic comedy, and too many stars."
"tt2193418";"Hammer of the Gods";"Action, Adventure, History";2013;"https://m.media-amazon.com/images/M/MV5BMTY5ODY2NjE5OF5BMl5BanBnXkFtZTcwNzY4NzAzOQ@@._V1_SX300.jpg";4.5;4.4;0.0;"Absolutely rubbish!"
"tt2199571";"Run All Night";"Action, Crime, Drama, Thriller";2015;"https://m.media-amazon.com/images/M/MV5BMTU2ODI3ODEyOV5BMl5BanBnXkFtZTgwMTM3NTQzNDE@._V1_SX300.jpg";6.6;5.9;50.0;"6.5/10"
"tt2201221";"Some Girl(s)";"Comedy, Drama";2013;"https://m.media-amazon.com/images/M/MV5BMTQ0ODI2NDM5MF5BMl5BanBnXkFtZTcwMTkwOTU1OQ@@._V1_SX300.jpg";4.6;4.8;0.0;"A movie with good acting but the main character is so unlikeable that it makes the movie hard to watch. I give it a B-."
"tt2203939";"The Other Woman";"Comedy, Romance";2014;"https://m.media-amazon.com/images/M/MV5BMTc0ODE4ODY1OF5BMl5BanBnXkFtZTgwMDA5NjkzMTE@._V1_SX300.jpg";6.0;3.9;40.0;"Excellent movie. Very funny!"
"tt2205401";"Addicted";"Drama, Thriller";2014;"https://m.media-amazon.com/images/M/MV5BNjMzMTUyNzU3Nl5BMl5BanBnXkFtZTgwNjM5MjAwMjE@._V1_SX300.jpg";5.2;3.2;5.0;"Way better than I expected."
"tt2205697";"Stuck in Love";"Comedy, Drama, Romance";2013;"https://m.media-amazon.com/images/M/MV5BMTU1NzI5MDU3OV5BMl5BanBnXkFtZTcwNTE0NDMzOQ@@._V1_SX300.jpg";7.3;4.9;0.0;"Stuck in indifference"
"tt2209418";"Before Midnight";"Drama, Romance";2013;"https://m.media-amazon.com/images/M/MV5BMjA5NzgxODE2NF5BMl5BanBnXkFtZTcwNTI1NTI0OQ@@._V1_SX300.jpg";7.9;9.4;3.0;"Not as wonderful as the last one but definitely worth your time"
"tt2209764";"Transcendence";"Drama, Mystery, Romance, Sci-Fi, Thriller";2014;"https://m.media-amazon.com/images/M/MV5BMTc1MjQ3ODAyOV5BMl5BanBnXkFtZTgwNjI1NDQ0MTE@._V1_SX300.jpg";6.3;4.2;100.0;"Intriguing storyline which goes to the heart of human existence"
"tt2213054";"Kai po che!";"Drama, Sport";2013;"https://m.media-amazon.com/images/M/MV5BMTgwNTAwMjEzMF5BMl5BanBnXkFtZTcwNzMzODY4OA@@._V1._CR10,12.166671752929688,793,1053.000015258789_SY132_CR5,0,89,132_AL_.jpg_V1_SX300.jpg";7.6;4.0;0.0;"Spellbinding, Enthralling, Amazing and So On..."
"tt2215285";"Madea's Witness Protection";"Comedy, Crime, Drama";2012;"https://m.media-amazon.com/images/M/MV5BMjAzMjczMTU4Nl5BMl5BanBnXkFtZTcwMDk1MTE5Nw@@._V1_SX300.jpg";5.0;4.2;20.0;"The acting is simply terrible"
"tt2217594";"WordWorld: Welcome to WordWorld";"N/A";2007;"Image Not Available";0.0;0.0;0.0;""
"tt2218003";"Closed Circuit";"Crime, Drama, Mystery, Thriller";2013;"https://m.media-amazon.com/images/M/MV5BMjc3MTU2MzI2Ml5BMl5BanBnXkFtZTcwMzI3ODI2OQ@@._V1_SX300.jpg";6.2;5.0;15.0;"did the British government have anything to do with the low rating?"
"tt2223990";"Draft Day";"Drama, Sport";2014;"https://m.media-amazon.com/images/M/MV5BMjAyOTMxMjA3Nl5BMl5BanBnXkFtZTgwMTMwNjQ4MDE@._V1_SX300.jpg";6.8;5.4;25.0;"Like NFL Draft Day itself, it starts slow but the payoff works"
"tt2224026";"Home";"Animation, Adventure, Comedy, Family, Fantasy, Sci-Fi";2015;"https://m.media-amazon.com/images/M/MV5BMjExOTQ4MDMyMV5BMl5BanBnXkFtZTgwMTE3NDM2MzE@._V1_SX300.jpg";6.6;5.5;135.0;"Weak - Dreamworks can do better than this!"
"tt2224317";"Lootera";"Drama, Romance";2013;"https://m.media-amazon.com/images/M/MV5BOTUwNTYyMzk4Ml5BMl5BanBnXkFtZTcwMTY2Mzc4OQ@@._V1_SX300.jpg";7.3;0.0;0.0;"'LOOTERA' is poetry on celluloid!"
"tt2226417";"Insidious: Chapter 2";"Horror, Mystery, Thriller";2013;"https://m.media-amazon.com/images/M/MV5BMTg0OTA5ODIxNF5BMl5BanBnXkFtZTcwNTUzNDg4OQ@@._V1_SX300.jpg";6.6;4.0;5.0;"Things that go bump in the night"
"tt2229499";"Don Jon";"Comedy, Drama, Romance";2013;"https://m.media-amazon.com/images/M/MV5BMTQxNTc3NDM2MF5BMl5BanBnXkFtZTcwNzQ5NTQ3OQ@@._V1._CR28,28.649993896484375,1271,1991.0000305175781_SX89_AL_.jpg_V1_SX300.jpg";6.6;6.6;3.0;"Solid, hard to define indie satire which will make some very uncomfortable - EXCELLENT first directorial effort!"
"tt2229842";"Table No. 21";"Adventure, Drama, Mystery, Thriller";2013;"https://m.media-amazon.com/images/M/MV5BMDFiZDYwNzQtZjhmMi00MTEwLTgxNWEtYzMyZmNlMDgzY2I2XkEyXkFqcGdeQXVyODE5NzE3OTE@._V1_SX300.jpg";7.1;0.0;0.0;"An excellent start to 2013!"
"tt2231253";"Wild Card";"Action, Crime, Drama, Thriller";2015;"https://m.media-amazon.com/images/M/MV5BMjAyNjkyOTgzNF5BMl5BanBnXkFtZTgwMTk0MDc2MzE@._V1_SX300.jpg";5.6;4.0;30.0;"What's up with the low rating!? It's quite good! (pssst Corey Yuen is the action choreographer)"
"tt2231461";"Rampage";"Action, Adventure, Sci-Fi";2018;"https://m.media-amazon.com/images/M/MV5BNDA1NjA3ODU3OV5BMl5BanBnXkFtZTgwOTg3MTIwNTM@._V1_SX300.jpg";6.1;4.5;120.0;"Lame, Cliche and Predictable"
"tt2234003";"Calvary";"Drama";2014;"https://m.media-amazon.com/images/M/MV5BMTc3MjQ1MjE2M15BMl5BanBnXkFtZTgwNTMzNjE4MTE@._V1_SX300.jpg";7.4;7.7;0.0;"An Irish High Noon"
"tt2234155";"The Internship";"Comedy";2013;"https://m.media-amazon.com/images/M/MV5BMjM1MzczMDgwOV5BMl5BanBnXkFtZTcwMDM4NjM2OQ@@._V1_SX300.jpg";6.3;4.2;58.0;"Can't help wondering these reviews are bought"
"tt2235108";"Dear White People";"Comedy, Drama, Romance";2014;"https://m.media-amazon.com/images/M/MV5BMjMzMjc5MjIzNV5BMl5BanBnXkFtZTgwNTY4OTQ2MjE@._V1_SX300.jpg";6.1;7.9;0.0;"Doesn't Deliver on Promising Trailer"
"tt2235779";"The Quiet Ones";"Horror";2014;"https://m.media-amazon.com/images/M/MV5BMzM5OTQxNTQwNV5BMl5BanBnXkFtZTgwNjE4NzMxMTE@._V1_SX300.jpg";5.1;4.1;0.2;"Fresh, interesting British Horror"
"tt2238032";"Skiptrace";"Action, Adventure, Comedy, Crime, Thriller";2016;"https://m.media-amazon.com/images/M/MV5BNzAzNTUyOTEtYzRmNy00NjZhLThhNjgtNGM1ZTFjZGEyZWFhXkEyXkFqcGdeQXVyNTQxMzIzMDc@._V1_SX300.jpg";5.7;5.0;32.0;"For hardcore Jackie Chan only"
"tt2239400";"Head Games";"Documentary, Sport";2012;"https://images-na.ssl-images-amazon.com/images/M/MV5BODkyNTMwNjQ0OF5BMl5BanBnXkFtZTcwNjQwOTIyOA@@._V1_SX300.jpg";7.4;0.0;0.0;"All parents and coaches should see this."
"tt2239832";"Think Like a Man Too";"Comedy, Romance";2014;"https://m.media-amazon.com/images/M/MV5BMjE2NjMxNjU1OF5BMl5BanBnXkFtZTgwMTI1OTgxMTE@._V1_SX300.jpg";5.8;3.8;24.0;"Light hearted fun"
"tt2241351";"Money Monster";"Crime, Drama, Thriller";2016;"https://m.media-amazon.com/images/M/MV5BMTgzMjU1NDUwMl5BMl5BanBnXkFtZTgwODg1NjY0ODE@._V1_SX300.jpg";6.5;5.5;27.0;"A film that cannot make up its mind"
"tt2243389";"I'm So Excited!";"Comedy";2013;"https://m.media-amazon.com/images/M/MV5BMTYxODgwNDQyOF5BMl5BanBnXkFtZTcwMzM2NjkwOQ@@._V1_SX300.jpg";5.6;5.5;5.77;"Almodovar's poorest effort"
"tt2243537";"A Haunted House";"Comedy, Fantasy";2013;"https://m.media-amazon.com/images/M/MV5BMTM1ODgyOTI0NF5BMl5BanBnXkFtZTcwODgyMDY3OA@@._V1_SX300.jpg";5.1;2.0;2.5;"There's A Ghost In The House With Some Serious Life Issues."
"tt2244901";"I Give It a Year";"Comedy, Romance";2013;"https://m.media-amazon.com/images/M/MV5BMTg5NDk4MTUwNl5BMl5BanBnXkFtZTcwMDU5MTc4OQ@@._V1_SX300.jpg";5.7;5.0;0.0;"Review of I Give It A Year"
"tt2245003";"Miss You Already";"Comedy, Drama, Romance";2015;"https://m.media-amazon.com/images/M/MV5BMjQzNDE1OTM5M15BMl5BanBnXkFtZTgwMTQwMTAwNzE@._V1_SX300.jpg";6.8;5.9;0.0;"Should I stay or should I go"
"tt2245084";"Big Hero 6";"Animation, Action, Adventure, Comedy, Drama, Family, Sci-Fi";2014;"https://m.media-amazon.com/images/M/MV5BMDliOTIzNmUtOTllOC00NDU3LWFiNjYtMGM0NDc1YTMxNjYxXkEyXkFqcGdeQXVyNTM3NzExMDQ@._V1_SX300.jpg";7.8;7.4;165.0;"Who wouldn't want the ultimate best friend?"
"tt2246887";"Back in the Day";"Comedy";2014;"https://m.media-amazon.com/images/M/MV5BMjI4MjA4Mzg2MV5BMl5BanBnXkFtZTgwMTgxMzM3MDE@._V1_SX300.jpg";5.1;0.7;1.0;"Just watched it! *THUMBS UP* I laughed. I cried. I farted."
"tt2247476";"When the Game Stands Tall";"Drama, Family, Sport";2014;"https://m.media-amazon.com/images/M/MV5BMTQ5NDMzOTI3MV5BMl5BanBnXkFtZTgwMjU4MTMyMjE@._V1_SX300.jpg";6.7;4.1;15.0;"Excellent film; but ..."
"tt2261331";"Black Sea";"Adventure, Drama, Thriller";2015;"https://m.media-amazon.com/images/M/MV5BMjMyNzI1ODA3OF5BMl5BanBnXkFtZTgwMTI5OTczMzE@._V1._CR54,54,1274,1940_SX89_AL_.jpg_V1_SX300.jpg";6.4;6.2;10.21;"Nothing that will win awards or become a classic, but it was entertaining and very much worth your time. I really enjoyed this."
"tt2262227";"The Book of Life";"Animation, Adventure, Comedy, Family, Fantasy, Musical, Romance";2014;"https://m.media-amazon.com/images/M/MV5BMTkzOTgzNDYzOF5BMl5BanBnXkFtZTgwOTgxMTkyMjE@._V1_SX300.jpg";7.3;6.7;50.0;"Proud Showcase of Mexican Culture"
"tt2262345";"Long Way North";"Animation, Action, Adventure, Drama, Family";2016;"https://m.media-amazon.com/images/M/MV5BMjA4MTYwNzg2Ml5BMl5BanBnXkFtZTgwNjEzNTI4NzE@._V1_SX300.jpg";7.3;7.0;6.92;"Straightforward and beautifully crafted"
"tt2263944";"Dragon Ball Z: Battle of Gods";"Animation, Action, Comedy, Fantasy, Sci-Fi";2014;"https://m.media-amazon.com/images/M/MV5BMjE2MzUwODUxMl5BMl5BanBnXkFtZTgwMTI0NDkzMjE@._V1_SX300.jpg";7.2;0.0;0.0;"The Spirit of the original Dragon Ball lives on,  A great mix of classic elements"
"tt2265171";"The Raid 2";"Action, Crime, Thriller";2014;"https://m.media-amazon.com/images/M/MV5BMTg5MTE2NjA4OV5BMl5BanBnXkFtZTgwMTUyMjczMTE@._V1_SX300.jpg";8.0;7.1;4.5;"The Greatest Action Film Under The Sun"
"tt2265398";"Drinking Buddies";"Comedy, Drama, Romance";2013;"https://m.media-amazon.com/images/M/MV5BMjMwNDU1NzMzM15BMl5BanBnXkFtZTcwNTY3ODk1OQ@@._V1_SX300.jpg";6.1;7.1;0.0;"Delightful, breezy slice of life"
"tt2265534";"The Lifeguard";"Drama, Romance";2013;"https://m.media-amazon.com/images/M/MV5BMjExOTI5MjY3Ml5BMl5BanBnXkFtZTcwMjU2NDk3OQ@@._V1_SX300.jpg";5.6;3.4;0.0;"The Lifeguard Review"
"tt2267968";"Kung Fu Panda 3";"Animation, Action, Adventure, Comedy, Family, Fantasy";2016;"https://m.media-amazon.com/images/M/MV5BMTUyNzgxNjg2M15BMl5BanBnXkFtZTgwMTY1NDI1NjE@._V1_SX300.jpg";7.1;6.6;145.0;"Another great movie"
"tt2267998";"Gone Girl";"Crime, Drama, Mystery, Thriller";2014;"https://m.media-amazon.com/images/M/MV5BMTk0MDQ3MzAzOV5BMl5BanBnXkFtZTgwNzU1NzE3MjE@._V1_SX300.jpg";8.1;7.9;61.0;"Expect some Oscar nominations for this outstanding piece of cinema!"
"tt2268016";"Magic Mike XXL";"Comedy, Drama, Music";2015;"https://m.media-amazon.com/images/M/MV5BNDMyODU3ODk3Ml5BMl5BanBnXkFtZTgwNDc1ODkwNjE@._V1_SX300.jpg";5.6;6.0;14.8;"More Bumps Than Grinds"
"tt2273657";"True Story";"Crime, Drama, Mystery, Thriller";2015;"https://m.media-amazon.com/images/M/MV5BZWM2ODc1MGYtYjNkMC00MTQ0LTk1ZWYtYWVjYTg3MzhiZWFlXkEyXkFqcGdeQXVyNTUzOTUwMTk@._V1_SX300.jpg";6.3;5.0;0.0;"The Truth Always Matters"
"tt2275946";"Redirected";"Action, Comedy, Crime, Thriller";2014;"https://m.media-amazon.com/images/M/MV5BMjI5OTM2NzA1M15BMl5BanBnXkFtZTgwMDk1NTMxMTE@._V1_SX300.jpg";6.7;0.0;2.7;"Very fun and entertaining movie"
"tt2277860";"Finding Dory";"Animation, Adventure, Comedy, Family";2016;"https://m.media-amazon.com/images/M/MV5BNzg4MjM2NDQ4MV5BMl5BanBnXkFtZTgwMzk3MTgyODE@._V1_SX300.jpg";7.3;7.7;200.0;"Charming and amusing."
"tt2278388";"The Grand Budapest Hotel";"Adventure, Comedy, Drama";2014;"https://m.media-amazon.com/images/M/MV5BMzM5NjUxOTEyMl5BMl5BanBnXkFtZTgwNjEyMDM0MDE@._V1_SX300.jpg";8.1;8.8;25.0;"A brilliantly entertaining fantasy outing by Wes Anderson"
"tt2279339";"Love the Coopers";"Comedy, Fantasy, Romance";2015;"https://m.media-amazon.com/images/M/MV5BMjE4NTkyODk4NF5BMl5BanBnXkFtZTgwNjY0NzkxNzE@._V1_SX300.jpg";5.8;3.1;17.0;"Funny, Realistic, and A Long-Winded ""Christmas"" Tale"
